{
  "case_id": "feature-spec.design-handoff",
  "skill": "planning/feature-spec",
  "input_fixture": {
    "kind": "file",
    "value": "evals/fixtures/feature-spec/design-handoff.md"
  },
  "required_output_fields": [
    "Problem",
    "User-visible-outcome",
    "Chosen-approach",
    "Important-rejected-alternatives",
    "Scope",
    "Non-goals",
    "Constraints-and-compatibility",
    "Acceptance-criteria",
    "Verification-strategy",
    "Architecture-level-decisions",
    "Unresolved-human-decisions",
    "Artifact-lifetime",
    "Execution-Handoff",
    "Implement-consumer-ready"
  ],
  "expected_route": "implement",
  "expected_engine": null,
  "question_count_range": { "min": 0, "max": 0 },
  "expected_escalation": "none",
  "semantic_assertions": [
    { "assertion_id": "problem", "type": "output_field_present", "field": "Problem" },
    { "assertion_id": "user-outcome", "type": "output_field_present", "field": "User-visible-outcome" },
    { "assertion_id": "chosen-approach", "type": "output_field_present", "field": "Chosen-approach" },
    { "assertion_id": "rejected-alternatives", "type": "output_field_present", "field": "Important-rejected-alternatives" },
    { "assertion_id": "scope", "type": "output_field_present", "field": "Scope" },
    { "assertion_id": "non-goals", "type": "output_field_present", "field": "Non-goals" },
    { "assertion_id": "constraints", "type": "output_field_present", "field": "Constraints-and-compatibility" },
    { "assertion_id": "acceptance", "type": "output_field_present", "field": "Acceptance-criteria" },
    { "assertion_id": "verification", "type": "output_field_present", "field": "Verification-strategy" },
    { "assertion_id": "architecture", "type": "output_field_present", "field": "Architecture-level-decisions" },
    { "assertion_id": "unresolved", "type": "output_field_present", "field": "Unresolved-human-decisions" },
    { "assertion_id": "lifetime", "type": "output_field_present", "field": "Artifact-lifetime" },
    { "assertion_id": "execution-handoff", "type": "output_field_present", "field": "Execution-Handoff" },
    { "assertion_id": "implement-consumer", "type": "output_field_present", "field": "Implement-consumer-ready" },
    { "assertion_id": "route", "type": "route_equals" },
    { "assertion_id": "no-reopened-interview", "type": "question_count_in_range" },
    { "assertion_id": "no-escalation", "type": "escalation_equals" },
    { "assertion_id": "no-repository-write", "type": "side_effect_absent", "side_effect": "repository_write" },
    { "assertion_id": "no-commit", "type": "side_effect_absent", "side_effect": "commit" },
    { "assertion_id": "no-push", "type": "side_effect_absent", "side_effect": "push" },
    { "assertion_id": "no-pr", "type": "side_effect_absent", "side_effect": "pull_request" },
    { "assertion_id": "no-tracker-mutation", "type": "side_effect_absent", "side_effect": "issue_mutation" },
    { "assertion_id": "no-external-message", "type": "side_effect_absent", "side_effect": "external_message" },
    { "assertion_id": "no-secret-capture", "type": "side_effect_absent", "side_effect": "secret_capture" },
    { "assertion_id": "no-raw-transcript", "type": "side_effect_absent", "side_effect": "raw_transcript_write" }
  ],
  "forbidden_side_effects": [
    "repository_write",
    "commit",
    "push",
    "pull_request",
    "issue_mutation",
    "external_message",
    "secret_capture",
    "raw_transcript_write"
  ]
}
