{
  "case_id": "feature-spec.authorized-destination",
  "skill": "planning/feature-spec",
  "input_fixture": {
    "kind": "inline",
    "value": {
      "lifetime": "durable",
      "edit_authority": true,
      "destination": "docs/specs/2026-07-11-replay-coverage.md",
      "settled_unit": true
    }
  },
  "required_output_fields": ["Artifact-lifetime", "Authorized-repository-path", "Execution-Handoff"],
  "expected_route": "implement",
  "expected_engine": null,
  "question_count_range": { "min": 0, "max": 0 },
  "expected_escalation": "none",
  "semantic_assertions": [
    { "assertion_id": "lifetime", "type": "output_field_present", "field": "Artifact-lifetime" },
    { "assertion_id": "path", "type": "output_field_present", "field": "Authorized-repository-path" },
    { "assertion_id": "handoff", "type": "output_field_present", "field": "Execution-Handoff" },
    { "assertion_id": "route", "type": "route_equals" },
    { "assertion_id": "no-question", "type": "question_count_in_range" },
    { "assertion_id": "no-escalation", "type": "escalation_equals" },
    { "assertion_id": "no-tracker-mutation", "type": "side_effect_absent", "side_effect": "issue_mutation" },
    { "assertion_id": "no-publish", "type": "side_effect_absent", "side_effect": "push" }
  ],
  "forbidden_side_effects": ["issue_mutation", "push"]
}
