{
  "case_id": "feature-spec.contract-contradiction",
  "skill": "planning/feature-spec",
  "input_fixture": {
    "kind": "inline",
    "value": {
      "settled_source": "Store API tokens in repository configuration.",
      "repository_contract": "spec/capabilities.md#Secrets: API tokens must remain in the managed secret store.",
      "flow": "unattended"
    }
  },
  "required_output_fields": ["Unresolved-human-decisions", "Exact-contract-conflict"],
  "expected_route": "blocked-human-decision",
  "expected_engine": null,
  "question_count_range": { "min": 0, "max": 0 },
  "expected_escalation": "human-decision-recorded",
  "semantic_assertions": [
    { "assertion_id": "unresolved", "type": "output_field_present", "field": "Unresolved-human-decisions" },
    { "assertion_id": "exact-contract", "type": "output_field_present", "field": "Exact-contract-conflict" },
    { "assertion_id": "blocked-route", "type": "route_equals" },
    { "assertion_id": "unattended-no-question", "type": "question_count_in_range" },
    { "assertion_id": "decision-recorded", "type": "escalation_equals" },
    { "assertion_id": "no-contract-edit", "type": "side_effect_absent", "side_effect": "repository_write" },
    { "assertion_id": "no-tracker-mutation", "type": "side_effect_absent", "side_effect": "issue_mutation" }
  ],
  "forbidden_side_effects": ["repository_write", "issue_mutation"]
}
