{
  "case_id": "feature-spec.tracker-task-ac-preservation",
  "skill": "planning/feature-spec",
  "input_fixture": {
    "kind": "inline",
    "value": {
      "source": "clear tracker task",
      "settled": true,
      "title": "Add a reversible response-schema migration",
      "problem": "The service needs a new response representation without breaking existing clients or making the data migration irreversible.",
      "user_visible_outcome": "Clients can adopt the new representation while existing integrations continue to receive their current response fields.",
      "chosen_approach": "Introduce a compatibility-preserving response migration with a verified rollback path.",
      "scope": "Response compatibility, migration behavior, rollback safety, and their verification.",
      "non_goals": "Removing existing response fields or publishing tracker changes.",
      "constraints": "Preserve the existing response contract and prevent data loss during rollback.",
      "verification_strategy": "Exercise old and new client responses and prove forward migration plus rollback against representative data.",
      "architecture_decisions": "Keep compatibility at the service response boundary and treat migration and rollback as one reversible lifecycle.",
      "artifact_lifetime": "response-only",
      "preselected_route": "relay",
      "acceptance_criteria": [
        "Existing clients receive the same response fields.",
        "The migration can be rolled back without data loss."
      ]
    }
  },
  "required_output_fields": [
    "Feature-Spec-title",
    "Problem",
    "User-visible-outcome",
    "Chosen-approach",
    "Important-rejected-alternatives",
    "Scope",
    "Non-goals",
    "Constraints-and-compatibility",
    "Acceptance-criteria",
    "Verification-strategy",
    "Architecture-level-decisions",
    "Unresolved-human-decisions",
    "Artifact-lifetime",
    "Execution-Handoff",
    "Existing-client-response-fields-preserved",
    "Rollback-without-data-loss-preserved",
    "Relay-plan-consumer-ready"
  ],
  "expected_route": "relay",
  "expected_engine": null,
  "question_count_range": { "min": 0, "max": 0 },
  "expected_escalation": "none",
  "semantic_assertions": [
    { "assertion_id": "feature-spec-title", "type": "output_field_present", "field": "Feature-Spec-title" },
    { "assertion_id": "problem", "type": "output_field_present", "field": "Problem" },
    { "assertion_id": "user-outcome", "type": "output_field_present", "field": "User-visible-outcome" },
    { "assertion_id": "chosen-approach", "type": "output_field_present", "field": "Chosen-approach" },
    { "assertion_id": "rejected-alternatives", "type": "output_field_present", "field": "Important-rejected-alternatives" },
    { "assertion_id": "scope", "type": "output_field_present", "field": "Scope" },
    { "assertion_id": "non-goals", "type": "output_field_present", "field": "Non-goals" },
    { "assertion_id": "constraints", "type": "output_field_present", "field": "Constraints-and-compatibility" },
    { "assertion_id": "acceptance", "type": "output_field_present", "field": "Acceptance-criteria" },
    { "assertion_id": "verification", "type": "output_field_present", "field": "Verification-strategy" },
    { "assertion_id": "architecture", "type": "output_field_present", "field": "Architecture-level-decisions" },
    { "assertion_id": "unresolved", "type": "output_field_present", "field": "Unresolved-human-decisions" },
    { "assertion_id": "lifetime", "type": "output_field_present", "field": "Artifact-lifetime" },
    { "assertion_id": "handoff", "type": "output_field_present", "field": "Execution-Handoff" },
    { "assertion_id": "existing-client-ac-preserved", "type": "output_field_present", "field": "Existing-client-response-fields-preserved" },
    { "assertion_id": "rollback-ac-preserved", "type": "output_field_present", "field": "Rollback-without-data-loss-preserved" },
    { "assertion_id": "relay-plan-consumer", "type": "output_field_present", "field": "Relay-plan-consumer-ready" },
    { "assertion_id": "honor-route", "type": "route_equals" },
    { "assertion_id": "no-reopened-interview", "type": "question_count_in_range" },
    { "assertion_id": "no-escalation", "type": "escalation_equals" },
    { "assertion_id": "no-tracker-mutation", "type": "side_effect_absent", "side_effect": "issue_mutation" },
    { "assertion_id": "no-relay-invocation", "type": "side_effect_absent", "side_effect": "external_message" }
  ],
  "forbidden_side_effects": ["issue_mutation", "external_message"]
}
